[
  {
    "问题类型": "版本能力限制",
    "触发关键词": ["团队版", "高级权限", "不支持", "升级版本"],
    "标准回复": "当前需求可能受版本能力限制，建议先确认版本能力范围，再评估升级路径",
    "适用场景": "功能受版本限制",
    "限制条件": "需先确认客户版本",
    "教程标题": "版本能力对比",
    "教程链接": "https://hc.huoban.com/",
    "是否已验证": "是",
    "更新时间": "2026-05-31"
  },
  {
    "问题类型": "流程执行人未命中",
    "触发关键词": ["没有备选执行人", "审批人为空", "无法流转"],
    "标准回复": "检查执行人配置、成员状态、变量赋值、组织关系",
    "适用场景": "审批节点无法分配执行人",
    "限制条件": "需流程配置权限",
    "教程标题": "流程与触发器说明",
    "教程链接": "https://hc.huoban.com/",
    "是否已验证": "是",
    "更新时间": "2026-05-31"
  },
  {
    "问题类型": "自动化误改数据恢复",
    "触发关键词": ["回滚", "撤回", "数据改错", "自动化改值"],
    "标准回复": "通常不支持一键撤回；少量手动恢复，大量人工评估恢复方案",
    "适用场景": "自动化执行后数据异常",
    "限制条件": "批量恢复需人工介入",
    "教程标题": "自动化排查入口",
    "教程链接": "https://hc.huoban.com/",
    "是否已验证": "是",
    "更新时间": "2026-05-31"
  },
  {
    "问题类型": "聚合表异常",
    "触发关键词": ["聚合表异常", "同步失败", "计算报错", "笛卡尔积"],
    "标准回复": "先保存获取具体报错，再排查表达式、连接条件、上游表状态",
    "适用场景": "聚合结果不更新/报错",
    "限制条件": "需聚合配置访问权限",
    "教程标题": "帮助中心（聚合相关）",
    "教程链接": "https://hc.huoban.com/",
    "是否已验证": "是",
    "更新时间": "2026-05-31"
  },
  {
    "问题类型": "权限冲突/页面打不开",
    "触发关键词": ["权限组冲突", "页面打不开", "无权限"],
    "标准回复": "先确认角色权限与版本边界，再给升级或替代方案",
    "适用场景": "权限配置后页面异常",
    "限制条件": "需管理员确认权限模型",
    "教程标题": "帮助中心首页",
    "教程链接": "https://hc.huoban.com/",
    "是否已验证": "是",
    "更新时间": "2026-05-31"
  },
  {
    "问题类型": "系统打不开（高风险）",
    "触发关键词": ["系统打不开", "无法访问", "白屏", "进不去"],
    "标准回复": "高优先级，升级人工；收集账号/时间/网络/截图",
    "适用场景": "系统级故障",
    "限制条件": "需人工通道响应",
    "教程标题": "帮助中心首页",
    "教程链接": "https://hc.huoban.com/",
    "是否已验证": "是",
    "更新时间": "2026-05-31"
  },
  {
    "问题类型": "数据丢失（高风险）",
    "触发关键词": ["数据丢失", "记录消失", "数据没了"],
    "标准回复": "优先升级人工；固定影响范围并停止高风险写入",
    "适用场景": "数据完整性风险",
    "限制条件": "需人工核查恢复策略",
    "教程标题": "帮助中心首页",
    "教程链接": "https://hc.huoban.com/",
    "是否已验证": "是",
    "更新时间": "2026-05-31"
  },
  {
    "问题类型": "附件格式不支持",
    "触发关键词": ["附件无法识别", "视频识别失败", "格式不支持"],
    "标准回复": "建议转换为常见文档/图片格式后重试",
    "适用场景": "附件解析失败",
    "限制条件": "受模型能力影响",
    "教程标题": "OpenAPI 文档入口",
    "教程链接": "https://hc.huoban.com/",
    "是否已验证": "是",
    "更新时间": "2026-05-31"
  },
  {
    "问题类型": "自动化配置咨询",
    "触发关键词": ["如何搭建自动化", "触发条件", "自动填写"],
    "标准回复": "先明确触发条件/目标字段/期望结果，再做触发器-分支-动作配置",
    "适用场景": "搭建类咨询",
    "限制条件": "涉版本能力先确认版本",
    "教程标题": "数据触发自动化",
    "教程链接": "https://hc.huoban.com/",
    "是否已验证": "是",
    "更新时间": "2026-05-31"
  },
  {
    "问题类型": "性能卡顿",
    "触发关键词": ["卡顿", "很慢", "响应慢", "打开慢"],
    "标准回复": "先确认范围/时间段/步骤/报错，再做性能定位",
    "适用场景": "性能体验问题",
    "限制条件": "需补充环境信息",
    "教程标题": "帮助中心首页",
    "教程链接": "https://hc.huoban.com/",
    "是否已验证": "是",
    "更新时间": "2026-05-31"
  }
]
